<?xml version="1.0" encoding="UTF-8"?>
<!DOCTYPE adatbazis [
<!ELEMENT adatbazis (dolgozo+) >
<!ELEMENT dolgozo (kod, nev, fizetes)>
<!ELEMENT kod (#PCDATA) >
<!ATTLIST dolgozo id ID #REQUIRED >
<!ELEMENT nev (#PCDATA) >
<!ELEMENT fizetes (#PCDATA) >
]>